Make,Model,Review,ratings,Rating,date,like_option,dislike_option,liked_options,disliked_options,user_intention,mentioned_makes,mentioned_models,mentioned_years,preferred_condition,newness_preference_score,newness_preference_notes,preferred_vehicle_type,preferred_fuel_type,openness_to_alternatives,misc_notes,persona_writing_style,persona_interaction_style,persona_family_background,persona_goal_summary,persona_query,persona_upper_price_limit
Ford,Bronco,Just bought a 24 bronco and it broke down at 20 miles. It had 8 miles on it when I got it and I drove it a whole 12. It's a cheap novelty imo. It overheated coolant was sprayed all under the hood and it had smoke pouring out of the engine. Worst decision ever. ,1,1,5/21/2024,[],"[{""make"": ""Ford"", ""model"": ""Bronco"", ""year"": 2024, ""condition"": ""new"", ""rationale"": ""The reviewer expresses strong dissatisfaction with the new Ford Bronco, citing a breakdown shortly after purchase.""}]",[],"[{""make"": ""Ford"", ""model"": ""Bronco"", ""year"": 2024, ""condition"": ""new"", ""rationale"": ""The reviewer expresses strong dissatisfaction with the new Ford Bronco, citing a breakdown shortly after purchase.""}]",The reviewer likely seeks to warn others about their negative experience with the Ford Bronco and may be looking for alternatives that are more reliable.,"[""Ford""]","[""Bronco""]",[2024],unspecified,1,"The reviewer had a very negative experience with a new vehicle, indicating a strong preference against new cars.",SUV,,10,The reviewer emphasizes reliability and expresses disappointment in the vehicle's performance.,"Direct and straightforward, expressing strong opinions based on personal experience.","Candid and open to suggestions, prioritizing reliability over brand loyalty.","The user likely values dependability in a vehicle due to past negative experiences, possibly considering family needs when choosing a car.","The user is looking for a reliable SUV alternative to the Ford Bronco 2024, preferably used, and is open to various options.","I'm looking for a reliable used SUV since my experience with the 2024 Ford Bronco was terrible. It broke down after just 12 miles, so I want to avoid new cars altogether. I'm open to any make or model as long as it’s dependable. My budget is up to $30,000.",30000.0
Ford,Bronco,"Waited two years on a waiting list and ended up with Badlands and 2.7 with Soft Top. Original Order was for a First Edition and when we were told the Top would not be molded in color due to manufacturing issues, we changed from the limited production First Edition to the combination above. Was completely blown away at the ride and handling versus our Wrangler. Still love the Wrangler, but the Bronco is so much more refined from both on and off road use. The openness of the roll cage versus the Wrangler was a great surprise as well. Had the typical first year production gremlins that i've experienced in Asian, German, and American vehicles we were early adopters of; comes with the territory and Ford stayed in touch and took care of them as they came up. Never driven anything outside of a military HUMMV that was this confidence inspiring off road, in the water, launching jet skis with no boat ramp, i mean at the turn of a dial all the off road modes did what was asked of them. Interior Noise shouldn't be a surprise to anyone who's owned a soft top Jeep. Interior material and drains holes for rinsing the sand and mud out were great. I would love it if Ford made a Solid one piece body like the Land Rover. No regrets at all. *Edmunds doesn't have Badlands with the 2.7 4door, but that was our combination so maybe they can fix that.",5,5,2/5/2024,"[{""make"": ""Ford"", ""model"": ""Bronco"", ""year"": null, ""condition"": ""new"", ""rationale"": ""The reviewer expresses strong satisfaction with the Ford Bronco, specifically the Badlands trim with the 2.7 engine.""}]","[{""make"": ""Jeep"", ""model"": ""Wrangler"", ""year"": null, ""condition"": ""either"", ""rationale"": ""While the reviewer still loves the Wrangler, they highlight that the Bronco is more refined, indicating a preference away from the Wrangler.""}]","[{""make"": ""Ford"", ""model"": ""Bronco"", ""year"": null, ""condition"": ""new"", ""rationale"": ""The reviewer expresses strong satisfaction with the Ford Bronco, specifically the Badlands trim with the 2.7 engine.""}]","[{""make"": ""Jeep"", ""model"": ""Wrangler"", ""year"": null, ""condition"": ""either"", ""rationale"": ""While the reviewer still loves the Wrangler, they highlight that the Bronco is more refined, indicating a preference away from the Wrangler.""}]",The reviewer is likely looking for recommendations for vehicles that offer similar or improved off-road capabilities and refinement compared to their current Bronco.,"[""Ford"", ""Jeep""]","[""Bronco"", ""Wrangler""]",[],new,10,"The reviewer waited two years for their new Bronco, indicating a strong preference for new vehicles.",SUV,gas,5,"The reviewer appreciates off-road capabilities and refinement, and they value manufacturer support for early production issues.","Conversational and enthusiastic, with a focus on personal experiences and preferences.","Direct and specific, seeking detailed recommendations based on past experiences.","The user is likely a family-oriented individual who values practicality and adventure, as indicated by their interest in off-road capabilities and refinement for family outings.","The user is looking for new SUVs with excellent off-road capabilities and refinement, similar to their Ford Bronco, with a maximum budget of $60,000.","I'm looking for a new SUV with great off-road capabilities and refinement, similar to my Ford Bronco Badlands with the 2.7 engine. I want it to be a 2025 model or newer, gas-powered, and I'm willing to consider alternatives to the Bronco, but my budget is up to $60,000. I appreciate good manufacturer support for any early production issues, as I experienced with Ford.",60000.0
Tesla,Model-3,"Needed a new car. I had no intention of buying an EV, let alone a Tesla. My wife wanted to check out EVs, so I reluctantly agreed. First we drove some plug-in hybrids. Meh. Then she showed me the price of a Model 3 and I agreed to test drive it. 1. You schedule test drive via online. We found it super convenient. Knew exactly when and where we would be test driving, no waiting in carlot for some idiot car salesman. 2. Sign in, Tesla rep greets us and lets us look around, then explains to us how to use the features. No sales pushing, just answering all our questions. 3. Supposed to be a 30 min test drive, we couldn't stop, went for an hour. It was thought changing. I went from being EV skeptic, to Tesla enthusiast in 60 min. 4. Went online and bought a car that afternoon. Again, no scumbag slimy car salesman, everything straight forward and easy. 5. Did have to download the app to finish the process to fill out the paperwork. But, this was fine, do it from living room couch rather than in a crazy office with some sales idiot bugging you to buy some stupid extras. 6. The only hiccup, app prompts you to pay before picking up car. I just messaged in the app that I preferred to see car before paying. Response, No problem. 7. Pickup fast efficient trouble free. People were great. The whole experience left us thinking, this all works together so well. Everything is well thought out and customer experience well thought out. Car is just a pleasure to drive. Fun, fast, quiet, fast, handles well. Relaxing to drive in traffic. With tax credits, cheaper than a Camry. We did get a wall charger, makes the ownership sooo much better. Just plug it in every night and never worry about range for normal commuting. Day three, first day commuting, we got a weird rock ding and broke front passenger door window. Got home. Called service (they answered fast) and the recommended using app to schedule service. (They offered to schedule over phone, but I wanted to try the app). Tried it, flawless to schedule service. Asked you to describe problem, take some pics and submit. Within minutes, got a message that a mobile appointment was scheduled. App asked for insurance, and that was it. Tech showed up in service time. Fixed window fast, answered a bunch of questions we had about features and then was off. No muss, no fuss. Mobile service was AWESOME! Oh, total cost to us was $0. Fit and finish great Driving in rain great 500 mile road trip with family of four great. Total cost, $16. Time at supercharger, 14 min from 30% to 95%. People complain about no car play/android auto, non issue. Tesla navigation is outstanding. Phone Bluetooth connects for calls. Connectivity lets you connect to streaming services you subscribe to. Don't care about carplay/android auto anymore, its irrelevant. You do have to take some time to learn how to use everything but its time well spent as there's sooo much there for you to tailor the car to how you want things. Tesla Model 3 LWD/AWD. Two months, 2000 miles. Loving it. Can't wait for our other car to have an issue, so we can justify getting a model Y.",5,5,9/28/2023,"[{""make"": ""Tesla"", ""model"": ""Model 3"", ""year"": null, ""condition"": ""new"", ""rationale"": ""The reviewer expresses strong satisfaction with the Tesla Model 3, highlighting its driving experience and features.""}, {""make"": ""Tesla"", ""model"": ""Model Y"", ""year"": null, ""condition"": ""unspecified"", ""rationale"": ""The reviewer indicates a desire to purchase a Model Y in the future.""}]","[{""make"": ""Toyota"", ""model"": ""Camry"", ""year"": null, ""condition"": ""unspecified"", ""rationale"": ""The reviewer compares the cost of the Model 3 favorably against the Camry, implying a preference against it.""}, {""make"": ""plug-in hybrids"", ""model"": null, ""year"": null, ""condition"": ""unspecified"", ""rationale"": ""The reviewer expresses dissatisfaction with plug-in hybrids, describing them as 'meh'.""}]","[{""make"": ""Tesla"", ""model"": ""Model 3"", ""year"": null, ""condition"": ""new"", ""rationale"": ""The reviewer expresses strong satisfaction with the Tesla Model 3, highlighting its driving experience and features.""}, {""make"": ""Tesla"", ""model"": ""Model Y"", ""year"": null, ""condition"": ""unspecified"", ""rationale"": ""The reviewer indicates a desire to purchase a Model Y in the future.""}]","[{""make"": ""Toyota"", ""model"": ""Camry"", ""year"": null, ""condition"": ""unspecified"", ""rationale"": ""The reviewer compares the cost of the Model 3 favorably against the Camry, implying a preference against it.""}, {""make"": ""plug-in hybrids"", ""model"": null, ""year"": null, ""condition"": ""unspecified"", ""rationale"": ""The reviewer expresses dissatisfaction with plug-in hybrids, describing them as 'meh'.""}]","The reviewer is looking for a seamless and enjoyable car buying experience, particularly interested in electric vehicles and the convenience of online processes.","[""Tesla"", ""Toyota""]","[""Model 3"", ""Camry"", ""Model Y""]",[],new,10,The reviewer purchased a new Tesla Model 3 and expresses excitement about it.,sedan,EV,5,"The reviewer values convenience, customer service, and a positive driving experience.","Conversational and enthusiastic, with a focus on personal experiences and preferences.","Prefers a straightforward, no-pressure interaction with clear information and options.","The reviewer is part of a family of four, indicating a need for a vehicle that accommodates their family comfortably.","The user seeks a seamless and enjoyable car buying experience, focusing on new electric vehicles with a preference for Tesla models.","I'm looking for a new electric sedan, preferably a Tesla Model Y, as I already love my Model 3. I want it to be as new as possible, ideally from 2025. I'm open to alternatives, but my focus is on EVs that offer a great driving experience and excellent customer service. My budget is up to $60,000.",60000.0
Ford,F-150,"I purchased the Ford f150 single cab with extended bed, & the 2.7 liter 6 cylinder. Everything was great. I bought the truck because my ford Ranger was getting a lot of miles & having issues. Needed something reliable. On my way home from work, I stopped at the grocery store, when I was ready to leave, I turn the key & it wouldn't start or even crank up at all. My display was showing multiple faults like brakes, camera, blind spot lights, among many other faults. The brake lights came on and wouldn't shut off until the battery went completely dead. It was 7pm. I went to the ford app & ordered a tow truck which did not arrive. By 1am I tried calling the tow truck company & they never answered. I called AAA which I should have done to begin with & even they didn't show up until 6am. I sat in my truck for 11 hrs in the grocery store parking lot totally stranded. By 8am I called the ford dealer to get a tow truck to my house & was furious by that point. A tow truck arrived a couple hours later to take the truck to the dealer I bought it from. The dealer tells me there's 35 vehicles ahead of me waiting for service & it will be a while before they could even look at my truck. It's been 5 days & they still haven't looked at it. The day I bought the truck the sales person told me I wouldn't have any problems but if I did, they would take care of me emediatly. So glad I didn't trade in my 2011 ford ranger because I'm self employed & would be losing a lot of money and business. I bought my 2024 f150 just 6 weeks ago and it's already broke down and unusable! Here I am paying for a brand new truck I can't even use! Wishing now that I never would have bought it!! Total let down!!",2,2,8/19/2024,[],"[{""make"": ""Ford"", ""model"": ""F-150"", ""year"": 2024, ""condition"": ""new"", ""rationale"": ""The reviewer expresses significant dissatisfaction with the reliability of the new Ford F-150, indicating it broke down shortly after purchase.""}]",[],"[{""make"": ""Ford"", ""model"": ""F-150"", ""year"": 2024, ""condition"": ""new"", ""rationale"": ""The reviewer expresses significant dissatisfaction with the reliability of the new Ford F-150, indicating it broke down shortly after purchase.""}]",The reviewer is likely seeking a more reliable vehicle recommendation after their negative experience with the Ford F-150.,"[""Ford""]","[""F-150"", ""Ranger""]","[2024, 2011]",used,1,The reviewer is disappointed with their new purchase and implies a preference for used vehicles due to reliability concerns.,truck,gas,1,The reviewer prioritizes reliability and expresses frustration over the service experience and breakdown of their new truck.,"Frustrated and direct, expressing dissatisfaction with previous experiences.",Prefers straightforward communication with a focus on reliability and service.,"Self-employed, relying on a vehicle for business, indicating a need for a dependable truck.",Looking for a reliable used truck after a disappointing experience with a new Ford F-150.,"I'm looking for a reliable used truck after my terrible experience with the 2024 Ford F-150, which broke down just weeks after purchase. I need something dependable since I'm self-employed and can't afford downtime. Ideally, I want a gas truck, and I’m not open to new models. My budget is up to $35,000. Please help me find a better option!",35000.0
Chevrolet,Silverado-1500,"This is my first diesel truck. I went with the 3.0 Duramax. I was concerned it would not have enough power as I pull a lot of construction trailers. I am so pleased with this truck. I might not accelerate as fast as the 6.2 gas motor, but nobody needs to accelerate like that in the first place. Especially 1 pollen trailers. This is a very smooth truck and I am averaging above 18 mpg with consistent runs with my dump trailer.",5,5,4/22/2024,"[{""make"": ""Chevrolet"", ""model"": ""Silverado-1500"", ""year"": null, ""condition"": ""either"", ""rationale"": ""The reviewer expresses satisfaction with their Chevrolet Silverado-1500, particularly praising its smoothness and fuel efficiency.""}]",[],"[{""make"": ""Chevrolet"", ""model"": ""Silverado-1500"", ""year"": null, ""condition"": ""either"", ""rationale"": ""The reviewer expresses satisfaction with their Chevrolet Silverado-1500, particularly praising its smoothness and fuel efficiency.""}]",[],"The reviewer is looking for a reliable and efficient truck that can handle heavy towing, specifically for construction purposes.","[""Chevrolet""]","[""Silverado-1500""]",[],either,5,"The reviewer does not specify a preference for new or used, indicating flexibility.",truck,diesel,5,"The reviewer values smooth driving and fuel efficiency, especially for towing purposes.","Conversational and straightforward, expressing satisfaction and practical needs clearly.","Prefers a direct and informative approach, valuing efficiency and clarity in responses.","The user likely has a practical lifestyle, possibly related to construction or heavy-duty work, which influences their vehicle choice.","The user is seeking a reliable diesel truck, ideally a Chevrolet Silverado-1500 or similar, that offers smooth driving and fuel efficiency for towing construction trailers.","I'm looking for a reliable diesel truck, preferably a Chevrolet Silverado-1500 or something similar, that can handle heavy towing for construction. I’m flexible on whether it’s new or used, but I’d like it to be no older than 2025. Fuel efficiency and a smooth drive are important to me, and I’m open to alternatives. My budget is up to $50,000.",50000.0
Honda,CR-V,"Having owned multiple CRVs, I've observed a significant improvement in cabin noise reduction compared to earlier models, particularly when the trunk is open during operation. Furthermore, the headrest design has been enhanced, providing a more comfortable and ergonomic experience compared to previous iterations. Upon Bluetooth connection, the current device does not exhibit the multiple connection attempts observed in the previous model. The inclusion of reclining rear seats is a thoughtful feature, and it would have been particularly appreciated during trips when the children were younger.The vehicle's automatic engine stop-start system, which activates upon brake application, is a feature I find undesirable, despite the option to disable it. The vehicle lacks fog lights . A cargo cover isn't included. Furthermore, the gap is not concealed when the rear seats are in an upright position. It appears that SiriusXM is no longer available as a direct option, and the only way to access it is through streaming. Consequently, my spouse now needs to use a charger or Bluetooth to listen to something other than the radio while driving. I find that adjusting the settings with the steering wheel is somewhat time-consuming. Some individuals have mentioned the absence of a spare tire, whereas all of my vehicles have been equipped with one. Additionally, there is a larger infotainment system. The auto-dimming mirror is a welcome feature. However, the automatic high beams sometimes activate at unexpected moments, so I may need to adjust the settings or disable them entirely. It includes numerous options that are often offered as add-ons by other manufacturers.",4,4,8/18/2025,"[{""make"": ""Honda"", ""model"": ""CR-V"", ""year"": null, ""condition"": ""either"", ""rationale"": ""The reviewer appreciates the improvements in cabin noise reduction, headrest design, Bluetooth connectivity, reclining rear seats, auto-dimming mirror, and the larger infotainment system.""}]","[{""make"": ""Honda"", ""model"": ""CR-V"", ""year"": null, ""condition"": ""either"", ""rationale"": ""The reviewer finds the automatic engine stop-start system undesirable, notes the absence of fog lights, a cargo cover, and a spare tire, and mentions issues with the automatic high beams.""}]","[{""make"": ""Honda"", ""model"": ""CR-V"", ""year"": null, ""condition"": ""either"", ""rationale"": ""The reviewer appreciates the improvements in cabin noise reduction, headrest design, Bluetooth connectivity, reclining rear seats, auto-dimming mirror, and the larger infotainment system.""}]","[{""make"": ""Honda"", ""model"": ""CR-V"", ""year"": null, ""condition"": ""either"", ""rationale"": ""The reviewer finds the automatic engine stop-start system undesirable, notes the absence of fog lights, a cargo cover, and a spare tire, and mentions issues with the automatic high beams.""}]",The reviewer is looking for a vehicle that offers comfort and improved features while avoiding certain undesirable options. They may seek recommendations for vehicles that enhance their driving experience without the drawbacks mentioned.,"[""Honda""]","[""CR-V""]",[],either,7,The reviewer appreciates improvements in newer models but does not explicitly state a preference for brand new vehicles.,SUV,,6,The reviewer values comfort features and is concerned about practical aspects like connectivity and safety.,"Conversational and reflective, with a focus on personal experiences and practical considerations.",Open to suggestions but prefers clarity and relevance to personal needs.,"The user has a family and values comfort and practicality in a vehicle, particularly for trips with children.","The user seeks a comfortable SUV with improved features, avoiding certain undesirable options, and is open to alternatives.","I'm looking for a comfortable SUV, ideally a Honda CR-V, but I'm open to alternatives. I'd like something from the last few years, around a 7 in newness, and I want to avoid features like the automatic engine stop-start system and the absence of fog lights. My budget is up to $35,000, and I appreciate good connectivity options and safety features for family trips.",35000.0
Honda,CR-V,"I bought the 2026 Honda CR-V Hybrid Sport just two days ago, and Im already extremely frustrated. Before this, I owned a 2017 Ford Explorer Limited, and the difference in quality is simply shocking. The CR-Vs interior feels rushed and careless: cheap, rough plastics, poorly cut panels with even sharp edges. The lower dashboard is so thin and flimsy it feels like it could break with a light touch. The carpet is embarrassingly low quality, and the trunk is poorly designed, with no molded lining to organize the space. To make matters worse, the tailgate doesnt even open with the remote  something that should be standard in any modern car. The infotainment system is laughably basic, with very few features for a car at this price point. The USB ports are outdated and slow  and in 2026, not including a fast-charging USB-C is downright ridiculous. On top of that, there are no parking sensors, neither front nor rear, a feature that has become standard even in much cheaper vehicles. For nearly $40,000, the least you expect is quality and attention to detail. Instead, it feels like Honda only cared about cutting costs to increase profit. The result is a car that looks and feels cheap but is sold at a premium price. Sadly, this purchase has been a huge disappointment.",3,3,9/20/2025,[],"[{""make"": ""Honda"", ""model"": ""CR-V"", ""year"": 2026, ""condition"": ""new"", ""rationale"": ""The reviewer expresses significant frustration with the quality and features of the 2026 Honda CR-V Hybrid Sport.""}, {""make"": ""Ford"", ""model"": ""Explorer"", ""year"": 2017, ""condition"": ""used"", ""rationale"": ""The reviewer compares the CR-V unfavorably to their previous 2017 Ford Explorer Limited, indicating a preference for the Explorer's quality.""}]",[],"[{""make"": ""Honda"", ""model"": ""CR-V"", ""year"": 2026, ""condition"": ""new"", ""rationale"": ""The reviewer expresses significant frustration with the quality and features of the 2026 Honda CR-V Hybrid Sport.""}, {""make"": ""Ford"", ""model"": ""Explorer"", ""year"": 2017, ""condition"": ""used"", ""rationale"": ""The reviewer compares the CR-V unfavorably to their previous 2017 Ford Explorer Limited, indicating a preference for the Explorer's quality.""}]",The reviewer is likely seeking recommendations for a vehicle that offers better quality and features than their current Honda CR-V Hybrid Sport.,"[""Honda"", ""Ford""]","[""CR-V"", ""Explorer""]","[2026, 2017]",used,3,"The reviewer is dissatisfied with a new vehicle, indicating a preference for used options that may offer better quality.",SUV,hybrid,5,"The reviewer prioritizes quality, attention to detail, and value for money.","Frustrated and direct, expressing dissatisfaction with current vehicle quality.","Straightforward and candid, seeking honest recommendations.","The user is likely a family-oriented individual who values quality and practicality in a vehicle, given their previous ownership of a Ford Explorer.","To find a used SUV that offers better quality and features than the 2026 Honda CR-V Hybrid Sport, ideally a hybrid.","I'm looking for a used hybrid SUV that offers better quality than my disappointing 2026 Honda CR-V Hybrid Sport. I previously owned a 2017 Ford Explorer Limited, which I found to be much better in terms of quality and features. I'm open to alternatives but prefer something that isn't newer than 3 years old. My budget is up to $40,000, and I really prioritize quality and attention to detail in my next purchase.",40000.0
