Make,Model,Review,ratings,Rating,date,like_option,dislike_option,liked_options,disliked_options,user_intention,mentioned_makes,mentioned_models,mentioned_years,preferred_condition,newness_preference_score,newness_preference_notes,preferred_vehicle_type,preferred_fuel_type,openness_to_alternatives,misc_notes,persona_writing_style,persona_interaction_style,persona_family_background,persona_goal_summary,persona_query,persona_upper_price_limit
Ram,1500,"I had a 2015 Outdoorsman with a winch and after market rear bumper. It went 75K miles for me and then finally let me down while towing a 6500 lb travel trailer and it was going to be at least a week or two as no one could figure out what was wrong. Well, they still offered my over 5,000 bucks more than a year ago on a trade and this new one a ""Built to Serve"" edition was sitting there and the final price was right at the one I bought six years ago for financing. So, what has changed in five years? Well they are four inches longer. I didn't know that but do every time I try to park it. There are more bells and whistles for sure. So, here at first what stands out? It is the luxurious feel of this truck. I mean it is so smooth driving it is amazing. It is quiet inside and the dogs love the back with their extra four inches of space with the seats up out of the way. The truck is NOT my daily driver anymore and is mostly dedicated to towing the trailer and going to the transfer station and some light off roading in interesting places here in Montana. It certainly has the equipment to do that so now it is just seeing how it does over time. First impressions are a highly refined but still assuredly a beast. I got it to tow and it has the tow package. THAT I like including the trailer TPMS monitor. The sleeper package I didn't really want was the Ramboxes and the new ""barn door"" tailgate. OK, two weeks into it and I am really starting to like them. The Ramboxes are huge and FOR MY NEEDS, don't get in the way of space in the bed. AND, Going to the transfer station I open the doors and not the ""tail gate"" and can reach everything instead of having to throw half my body on the tail gate to reach stuff. OH, get the premium light package period. The LED headlights are worth their weight in gold compared to the old ones. Make that a must. But if gas mileage is a problem for you? Get a prius. Well, I got rid of the 1500. Not because I had a problem as such, but because it didn't tow my 6700 lb travel trailer as good as I needed. I bought a ""22"" 2500 in the same color and love it. So, IF you do NOT tow over 6000 lbs, I would actually go for a 1500 over a 2500. The Gen 5 1500 in a Bighorn trim and up is essentially a luxury daily driver with some very good capabilities for towing...up to around 6K in perfect comfort. The ride vs a 2500 is amazing. The 2500 is a truck and rides like a truck. It has the luxurious interior but less room in the cab as the dogs will attest to. I loved my 1500's all three of them, but IF you are going to tow and generally go above 6K on your trailer and above 25 feet, you might want to consider a 2500. It is a completely different ""towing"" experience...in a good way. A 2500 will be more ""planted"" and less subject to the wind. A 1500 never lets you forget you are towing...something that big... A 2500 gives you a bit more peace of mind and less stress... But basically, on both of them, I was happy...",4,4,7/15/2022,"[{""make"": ""Ram"", ""model"": ""1500"", ""year"": 2022, ""condition"": ""new"", ""rationale"": ""The reviewer appreciates the luxurious feel, smooth driving, and towing capabilities of the Ram 1500, especially in the 'Built to Serve' edition.""}, {""make"": ""Ram"", ""model"": ""2500"", ""year"": 2022, ""condition"": ""new"", ""rationale"": ""The reviewer expresses satisfaction with the 2500 for towing over 6000 lbs, highlighting its stability and comfort.""}]","[{""make"": ""Ram"", ""model"": ""1500"", ""year"": 2015, ""condition"": ""used"", ""rationale"": ""The reviewer mentions that the 2015 Ram 1500 did not tow their 6700 lb travel trailer as well as needed.""}]","[{""make"": ""Ram"", ""model"": ""1500"", ""year"": 2022, ""condition"": ""new"", ""rationale"": ""The reviewer appreciates the luxurious feel, smooth driving, and towing capabilities of the Ram 1500, especially in the 'Built to Serve' edition.""}, {""make"": ""Ram"", ""model"": ""2500"", ""year"": 2022, ""condition"": ""new"", ""rationale"": ""The reviewer expresses satisfaction with the 2500 for towing over 6000 lbs, highlighting its stability and comfort.""}]","[{""make"": ""Ram"", ""model"": ""1500"", ""year"": 2015, ""condition"": ""used"", ""rationale"": ""The reviewer mentions that the 2015 Ram 1500 did not tow their 6700 lb travel trailer as well as needed.""}]","The reviewer is looking for recommendations on trucks that excel in towing capabilities, particularly for heavier loads, while also considering comfort and luxury features.","[""Ram""]","[""1500"", ""2500""]","[2015, 2022]",new,8,The reviewer prefers newer models for better features and performance.,truck,gas,7,"The reviewer values towing capacity and comfort, especially for larger trailers.","Conversational and detailed, with personal anecdotes and specific preferences.","Engaging and informative, looking for tailored recommendations based on personal experiences.","The user has a family that includes dogs, which influences their need for space in a vehicle, particularly for towing and comfort during travel.","The user seeks recommendations for new trucks that excel in towing capabilities, particularly for heavier loads, while also providing comfort and luxury features.","I'm looking for a new truck, ideally a Ram 2500 or a newer Ram 1500, since I need something that can tow over 6000 lbs comfortably. I appreciate luxury features and smooth driving, especially for my family and dogs. I'm open to alternatives but prefer something from 2022 or later. My budget is around $70,000. Towing capacity and comfort are my top priorities.",70000.0
BMW,X5,"I like this car very much. I look forward to driving it and look for excuses to drive around and trips to take. So, let me just focus on the Cons: - The ride is jarring on rough roads. (I do not have the air suspension) Made more so by the run flat tires, which in principle I like. The run flats on a cold day on poorly maintained road is not pleasant. - The wide pillars increase blind spots. But if that is a trade off for safety in a crash, I'll take the wide pillars. - Back seat is comfortable but only adequately spacious. - No reclining rear seats. - Harmon Kardon system is only adequate. - Steering can be a little bit light and disconnected at times in some circumstances. - The single panel info screen looks a little awkward and could be better integrated. I think I prefer the two screen set-up with the ""gauge cluster"" buried in front of the driver. Knowing all this I still chose this car because all of Pros easily outweigh the Cons. The Pros are well covered in all of the rave reviews this machine gets, and I conquer. Note: The ""safety"" features are well integrated and easy to shut off. They stay off too, except for the greatest consumer hoax of all time, the Auto-Start-Stop ""feature"", appropriately, ASS. For this you create a short cut and its as easy to turn off it was with the button. You can no longer ""code"" it out, as in previous models. ",4,4,3/12/2025,"[{""make"": ""BMW"", ""model"": ""X5"", ""year"": null, ""condition"": ""either"", ""rationale"": ""The reviewer expresses a strong liking for the car and enjoys driving it.""}]","[{""make"": ""BMW"", ""model"": ""X5"", ""year"": null, ""condition"": ""either"", ""rationale"": ""The reviewer mentions several cons, including a jarring ride on rough roads, wide pillars increasing blind spots, and inadequate rear seat space.""}]","[{""make"": ""BMW"", ""model"": ""X5"", ""year"": null, ""condition"": ""either"", ""rationale"": ""The reviewer expresses a strong liking for the car and enjoys driving it.""}]","[{""make"": ""BMW"", ""model"": ""X5"", ""year"": null, ""condition"": ""either"", ""rationale"": ""The reviewer mentions several cons, including a jarring ride on rough roads, wide pillars increasing blind spots, and inadequate rear seat space.""}]",The reviewer is looking for a vehicle that balances comfort and safety features while being enjoyable to drive.,"[""BMW""]","[""X5""]",[],either,5,The reviewer appreciates the current model but does not specify a strong preference for new or used.,SUV,,5,The reviewer values safety features and comfort but is critical of certain design aspects and features.,"Conversational and reflective, with a focus on personal experience and practical considerations.",Open to dialogue but prefers concise and straightforward responses.,"The reviewer enjoys driving and values comfort and safety, indicating a lifestyle that includes family trips and daily commutes.","The user seeks a comfortable and safe SUV that is enjoyable to drive, balancing features and design.","I'm looking for a comfortable SUV, ideally a BMW X5, but I'm open to alternatives. I want something that balances safety features and driving enjoyment, similar to the X5, but with better rear seat space and ride comfort. I'm considering both new and used models from around 2025, and I’d like to keep the price under $70,000.",70000.0
BMW,X5,"Took delivery of a 2025 BMW X5 50e (PHEV) in March. Within three weeks an engine light came on ... software upgrade required, no big deal. However, end of June when the summer heat had arrived and charging at 120v starts to become an issue ... it either doesn't charge after being plugged in for 10 + hrs or, it sometimes even negative charges .... starts at 52% charged and next day is at 27%! Several trips to service and not able to diagnose problem, never mind fix it. But, I eventually learn it is a known issue, that may be rectified with a software update, but no software update imminent, but welcome to travel to the dealership for a charge at 240v. Consequently, most of my summer driving on ICE. Checked the chat boards online and learn it has also been a problem with previous model years. Not impressed from a premium brand.",2,2,8/15/2025,[],"[{""make"": ""BMW"", ""model"": ""X5"", ""year"": 2025, ""condition"": ""new"", ""rationale"": ""The reviewer expresses dissatisfaction with the 2025 BMW X5 due to multiple issues with charging and engine problems.""}]",[],"[{""make"": ""BMW"", ""model"": ""X5"", ""year"": 2025, ""condition"": ""new"", ""rationale"": ""The reviewer expresses dissatisfaction with the 2025 BMW X5 due to multiple issues with charging and engine problems.""}]","The reviewer is likely seeking a reliable vehicle that does not have the charging issues experienced with the BMW X5, possibly looking for alternatives that are more dependable.","[""BMW""]","[""X5""]",[2025],either,5,"The reviewer is open to both new and used vehicles, as they are looking for reliability rather than a specific new model.",SUV,PHEV,8,"The reviewer prioritizes reliability and effective charging capabilities, indicating frustration with the current vehicle's performance.","Direct and concise, expressing frustration and urgency.",Prefers straightforward communication with clear expectations.,The reviewer is likely a family-oriented individual who values reliability in a vehicle for daily use and possibly for family trips.,"The user seeks a reliable SUV with effective charging capabilities, avoiding the issues faced with the BMW X5.","I'm looking for a reliable SUV, preferably a PHEV, as I've had a frustrating experience with my 2025 BMW X5 due to charging issues. I'm open to both new and used options, ideally from the last couple of years, and I'm willing to consider alternatives to BMW. My budget is up to $60,000, and reliability is my top priority.",60000.0
BMW,X5,"Weve had the car now for almost a year. Very pleased with the vehicle, less so with the dealer. No maintenance issues after about five thousand miles. The handling, acceleration, and technology are superb. It takes awhile to learn the tech but thats true of ALL new vehicles. Most of it is pretty logical. A couple of minor nits: some glare from the drivers upper air vent reflecting into the side mirror should use black rather than silver. Too many button pushes instead of knobs for heat and air. Garage door refuses to pair with our opener had no trouble with 6 other cars. The car DOES run fine on regular and despite the howls from the purists, it states right in the manual that using regular gas WILL NOT hurt the engine. Fuel mileage is outstanding for a vehicle of this weight and performance I routinely get 28 mpg, even if traffic. Quiet and elegant. The dealership experience, however, both in purchase and in routine service leaves much to be desired. BMW apparently only allows one dealer per midsized city and they can pretty much do as they please regarding add-ons and junk fees. I negotiated to get my price but it wasnt pleasant. They insisted on 5 star reviews when the delivery for a luxury vehicle was 3.5 stars , maybe. The salesperson was upset when I gave them an honest review. A scheduled routine oil change took nearly 3 hours ! Another 3 star reviewno follow up to ask why. I bought a second BMW 9 months later because I was impressed with the car but drove two hours to use a different dealer. Much better treatment. BMW management, are you listening?",5,5,8/23/2025,"[{""make"": ""BMW"", ""model"": ""X5"", ""year"": 2025, ""condition"": ""either"", ""rationale"": ""The reviewer expresses high satisfaction with the BMW X5, praising its handling, acceleration, technology, and fuel mileage.""}]","[{""make"": ""BMW"", ""model"": ""X5"", ""year"": 2025, ""condition"": ""either"", ""rationale"": ""The reviewer criticizes the dealership experience, including long wait times for service and poor customer service.""}]","[{""make"": ""BMW"", ""model"": ""X5"", ""year"": 2025, ""condition"": ""either"", ""rationale"": ""The reviewer expresses high satisfaction with the BMW X5, praising its handling, acceleration, technology, and fuel mileage.""}]","[{""make"": ""BMW"", ""model"": ""X5"", ""year"": 2025, ""condition"": ""either"", ""rationale"": ""The reviewer criticizes the dealership experience, including long wait times for service and poor customer service.""}]",The reviewer is looking for a vehicle recommendation that offers a good driving experience while avoiding poor dealership interactions.,"[""BMW""]","[""X5""]",[2025],either,8,"The reviewer is satisfied with a relatively new vehicle, indicating a preference for newer models.",SUV,gas,5,The reviewer values performance and technology but is frustrated with dealership practices.,"Conversational and straightforward, with a focus on personal experiences and opinions.","Direct and honest, values clear communication and transparency.","The user has experience with luxury vehicles and is likely looking for a reliable SUV for family use, given their preference for performance and technology.",The user seeks a vehicle recommendation that combines excellent driving performance and technology while avoiding poor dealership experiences.,"I'm looking for a BMW X5 2025, preferably new, but I'm open to used options as well. I want a gas SUV that offers great handling and technology, and I hope to avoid the frustrating dealership experiences I've had in the past. I'm willing to consider alternatives but would like to keep my budget under $70,000.",70000.0
Hyundai,Tucson,"Due to age and mileage, I needed to replace my wife's Mercedes R500, which has served us very well for dog hauling, long-distance family trips, and daily use over 90K miles, as well as my S430, which has been a great mile-eater but not used enough. With the nearest MB dealer 90 miles away, and the local indie mech crazy busy, changing brands was a necessity. After searching for a replacement for over a year, and driving 20+ cars, the best choice to meet our needs was a 2025 Tucson Hybrid. It finally arrived last week, and the 2-for-1 deal was concluded with no hassle. I'm a car guy, mostly European sports and luxury, and I have to say the the newest Hyundai Tucson is as competent as any MB, Saab or BMW I've owned at a bargain price (for what it offers). Roomy, great seats, beautiful finishes, and so far 40+ MPG. It's quieter than my S-class, as roomy as you can get in such a small footprint, and with tech and customization of features and drive modes as you can get. I hate CVT's - so the 6-speed auto (plus hybrid drive) are great. Selectable regen is a plus (although when the smallish battery is charged it shuts off). The factory tires aren't the best but they do seem to boost mileage - we'll see how they do in snow. Steering is light and precise - and road manners are excellent. Brakes are good. Visibility is excellent. The hybrid's power is good for most situations - zippy around town, and easy passes on the highway. I'm surprised at how much the car drives on electric power alone - with very smooth transition to the gas engine. The new (for 2025) dash and instrument display is elegant and works great. Climate control is solid. We'll have to see how it is after a few months and more miles, but the initial impression it makes couldn't be better.",5,5,10/18/2024,"[{""make"": ""Hyundai"", ""model"": ""Tucson"", ""year"": 2025, ""condition"": ""new"", ""rationale"": ""The reviewer praises the 2025 Tucson Hybrid for its spaciousness, fuel efficiency, and overall performance.""}]","[{""make"": ""Mercedes"", ""model"": ""R500"", ""year"": null, ""condition"": ""used"", ""rationale"": ""The reviewer replaced the R500 due to age and mileage, indicating a preference to move away from it.""}, {""make"": ""Mercedes"", ""model"": ""S430"", ""year"": null, ""condition"": ""used"", ""rationale"": ""The reviewer mentions the S430 was not used enough, suggesting a lack of interest in keeping it.""}, {""make"": null, ""model"": null, ""year"": null, ""condition"": ""unspecified"", ""rationale"": ""The reviewer expresses a dislike for CVTs, indicating a preference against vehicles with this transmission type.""}]","[{""make"": ""Hyundai"", ""model"": ""Tucson"", ""year"": 2025, ""condition"": ""new"", ""rationale"": ""The reviewer praises the 2025 Tucson Hybrid for its spaciousness, fuel efficiency, and overall performance.""}]","[{""make"": ""Mercedes"", ""model"": ""R500"", ""year"": null, ""condition"": ""used"", ""rationale"": ""The reviewer replaced the R500 due to age and mileage, indicating a preference to move away from it.""}, {""make"": ""Mercedes"", ""model"": ""S430"", ""year"": null, ""condition"": ""used"", ""rationale"": ""The reviewer mentions the S430 was not used enough, suggesting a lack of interest in keeping it.""}, {""make"": null, ""model"": null, ""year"": null, ""condition"": ""unspecified"", ""rationale"": ""The reviewer expresses a dislike for CVTs, indicating a preference against vehicles with this transmission type.""}]","The reviewer is looking for a reliable and efficient vehicle that meets their family's needs, particularly for long-distance travel and daily use.","[""Hyundai"", ""Mercedes""]","[""Tucson"", ""R500"", ""S430""]",[2025],new,10,"The reviewer specifically purchased a new 2025 model, indicating a strong preference for brand new vehicles.",SUV,hybrid,8,"The reviewer values spaciousness, fuel efficiency, and advanced technology features.","Concise and informative, with a focus on specific features and personal experiences.","Direct and straightforward, seeking clear recommendations based on preferences.","The user has a family and requires a vehicle for long-distance trips, daily use, and dog hauling, indicating a need for practicality and space.","The user is looking for a new, spacious hybrid SUV that offers fuel efficiency and advanced technology features, with a strong preference for the latest model.","I'm looking for a new 2025 SUV, preferably a Hyundai Tucson Hybrid, as I need something spacious and fuel-efficient for family trips and daily use. I prefer a vehicle with advanced tech features and a 6-speed automatic transmission, avoiding CVTs. I'm open to alternatives but would like to stay within a budget of $40,000.",40000.0
Hyundai,Tucson,"Purchased a 2025 Hyundai Tucson hybrid in November 2024. The advertised mileage was 36/37, but after six months of driving were getting 26/27 and Im not a fast driver. That and there are several design problems - the start button is hidden behind the steering wheel, the rear turn signals are a foot off the ground, if we push the button on the rear hatch to close it we have to wait until its fully closed before we can get in the car. Otherwise it opens up again and we cant close it using the button inside the car. Extremely annoying when youre standing in pouring rain waiting for the hatch to close. We traded in our Subaru Outback, which we loved, and paid extra for this hybrid in order to get better gas mileage. The non-hybrid Outback got better mileage, Id never buy another Hyundai again.",1,1,6/9/2025,[],"[{""make"": ""Hyundai"", ""model"": ""Tucson"", ""year"": 2025, ""condition"": ""new"", ""rationale"": ""The reviewer expresses strong dissatisfaction with the Hyundai Tucson hybrid, citing poor mileage and design flaws.""}, {""make"": ""Hyundai"", ""model"": null, ""year"": null, ""condition"": ""unspecified"", ""rationale"": ""The reviewer states they would never buy another Hyundai again.""}]",[],"[{""make"": ""Hyundai"", ""model"": ""Tucson"", ""year"": 2025, ""condition"": ""new"", ""rationale"": ""The reviewer expresses strong dissatisfaction with the Hyundai Tucson hybrid, citing poor mileage and design flaws.""}, {""make"": ""Hyundai"", ""model"": null, ""year"": null, ""condition"": ""unspecified"", ""rationale"": ""The reviewer states they would never buy another Hyundai again.""}]",The reviewer is likely seeking a vehicle recommendation that offers better fuel efficiency and design than their current Hyundai Tucson hybrid.,"[""Hyundai"", ""Subaru""]","[""Tucson"", ""Outback""]","[2025, 2024]",used,1,The reviewer is dissatisfied with their new vehicle and prefers alternatives that are not Hyundai.,SUV,hybrid,1,The reviewer prioritizes fuel efficiency and functional design.,"Frustrated and direct, expressing dissatisfaction clearly.","Straightforward and concise, focusing on specific needs and past experiences.","The user seems to have a family-oriented lifestyle, previously owning a Subaru Outback which they loved, indicating a preference for reliable family vehicles.","The user is seeking a used hybrid SUV that offers better fuel efficiency and design than their current Hyundai Tucson hybrid, which they find unsatisfactory.","I'm looking for a used hybrid SUV that offers better fuel efficiency and design than my 2025 Hyundai Tucson hybrid, which has been a disappointment. I previously owned a Subaru Outback and loved it, so I'm considering alternatives but not Hyundai. Ideally, I want something that gets better mileage than my Tucson's 26/27 MPG. My budget is up to $35,000.",35000.0
Hyundai,Tucson,"Car is pretty good, but electronics are glitchy which is a huge problem for me because I bought the car for the ease of using CarPlay, Google Maps, etc, and often CarPlay glitches out or the screen goes black, and is unresponsive, and I am driving in the middle of a new place and have to pull over or pull out my phone and turn off bluetooth and navigate holding the phone, which is dangerous and stressful. I have spent three months trying to get a dealer to fix this and they seem unable to figure out whether its the ""unit"" or the ""screen"" - apparently they are sold as separate units. So I am still drivind around with glitchy electronics. ",3,3,12/5/2024,[],"[{""make"": ""Hyundai"", ""model"": ""Tucson"", ""year"": null, ""condition"": ""either"", ""rationale"": ""The reviewer expresses frustration with the glitchy electronics, which significantly impacts their experience.""}]",[],"[{""make"": ""Hyundai"", ""model"": ""Tucson"", ""year"": null, ""condition"": ""either"", ""rationale"": ""The reviewer expresses frustration with the glitchy electronics, which significantly impacts their experience.""}]",The reviewer is seeking a resolution for the electronic issues with their Hyundai Tucson and may be looking for recommendations on reliable vehicles with better technology integration.,"[""Hyundai""]","[""Tucson""]",[],either,5,"The reviewer does not specify a strong preference for new or used, indicating they may consider both.",SUV,,7,"The reviewer prioritizes reliable electronics and ease of use, particularly for navigation.","Direct and frustrated, expressing specific issues with technology.",Seeking straightforward recommendations with a focus on reliability and technology.,"The user likely has a busy lifestyle that requires reliable navigation, possibly indicating family responsibilities or frequent travel.",The user wants to find a reliable SUV with good technology integration to replace their glitchy Hyundai Tucson.,"I'm looking for a reliable SUV with good technology integration to replace my Hyundai Tucson. I need something that works well with navigation and doesn't have glitchy electronics like my current car. I'm open to both new and used options, ideally around 2023 or newer, and I'm willing to consider alternatives. My budget is up to $35,000.",35000.0
