Make,Model,Review,ratings,Rating,date,like_option,dislike_option,liked_options,disliked_options,user_intention,mentioned_makes,mentioned_models,mentioned_years,preferred_condition,newness_preference_score,newness_preference_notes,preferred_vehicle_type,preferred_fuel_type,openness_to_alternatives,misc_notes,persona_writing_style,persona_interaction_style,persona_family_background,persona_goal_summary,persona_query,persona_upper_price_limit
Toyota,RAV4,"I've only had this vehicle for just over a month. I traded a 2017 Corolla IM with 19,000 miles. The Rav4 drives smooth and quiet. It handles very nicely. I'm older so all the bells and whistles are too much for me. I'm still figuring out what some of these controls are for. Overall, I'm very happy.",5,5,7/20/2024,"[{""make"": ""Toyota"", ""model"": ""RAV4"", ""year"": null, ""condition"": ""new"", ""rationale"": ""The reviewer expresses happiness with the RAV4, indicating a strong preference for this vehicle.""}]",[],"[{""make"": ""Toyota"", ""model"": ""RAV4"", ""year"": null, ""condition"": ""new"", ""rationale"": ""The reviewer expresses happiness with the RAV4, indicating a strong preference for this vehicle.""}]",[],"The reviewer is looking for a vehicle that is easy to handle and comfortable, without overwhelming features.","[""Toyota""]","[""RAV4"", ""Corolla IM""]",[2017],new,10,"The reviewer is satisfied with a new vehicle, as indicated by their recent purchase of the RAV4.",SUV,gas,5,"The reviewer prefers a vehicle that is easy to understand and operate, suggesting a focus on comfort and simplicity.","Concise and straightforward, with a focus on clarity.","Prefers a direct and simple approach, avoiding overly technical jargon.","The user is older and values simplicity in controls, indicating a preference for user-friendly technology.","The user seeks a new, easy-to-handle SUV that is comfortable and not overwhelming, with a focus on Toyota models.","I'm looking for a new Toyota RAV4 or a similar SUV, ideally from 2025, with a gas engine. I want something easy to understand and operate, without too many complicated features. I'm open to alternatives but prefer simplicity. My budget is up to $35,000.",35000.0
Toyota,RAV4,"Love the very impressive gas mileage but that's about it. The seat isn't the most comfortable with the front edge of the drivers seat high and firm for those that drive with their legs extended and there is no way to adjust it lower. If you drive close to the wheel with knees bent, that shouldn't be a problem. The ""lane assist"" must be the worse idea anyone has ever had. Hate having the steering wheel (car) try to take control. The first time it happened was disturbing. It felt like I had to literally fight to control the car where I wanted to go when giving bicycle riders extra room as I passed. Good thing it can be disabled! I found the shifting to be somewhat harsh going into second and third gear when gently accelerating but seems to be improving both on the gentile and more normal accelerations after 850 miles. It rides over bumps and road imperfections more like a truck than a sedan. Road noise was okay but when a rear window is fully opened the interior suffers from a pulsating air compression effect where waves or blasts of air permeate. Very annoying.",3,3,12/12/2024,"[{""make"": ""Toyota"", ""model"": ""RAV4"", ""year"": null, ""condition"": ""unspecified"", ""rationale"": ""The reviewer appreciates the impressive gas mileage.""}]","[{""make"": ""Toyota"", ""model"": ""RAV4"", ""year"": null, ""condition"": ""unspecified"", ""rationale"": ""The reviewer finds the driver's seat uncomfortable and dislikes the lane assist feature.""}]","[{""make"": ""Toyota"", ""model"": ""RAV4"", ""year"": null, ""condition"": ""unspecified"", ""rationale"": ""The reviewer appreciates the impressive gas mileage.""}]","[{""make"": ""Toyota"", ""model"": ""RAV4"", ""year"": null, ""condition"": ""unspecified"", ""rationale"": ""The reviewer finds the driver's seat uncomfortable and dislikes the lane assist feature.""}]","The reviewer is looking for a vehicle that offers better comfort and control features, particularly in the seating and driving assistance areas.","[""Toyota""]","[""RAV4""]",[],unspecified,5,"The reviewer does not express a strong preference for new or used, indicating flexibility.",SUV,gas,5,"The reviewer prioritizes comfort and control in driving, as well as a smooth ride over bumps.","The user expresses their thoughts clearly and straightforwardly, focusing on specific preferences and experiences.","The user prefers a conversational and direct approach, seeking clear recommendations based on their needs.","The user likely has a family that values comfort and safety in a vehicle, as indicated by their focus on seating comfort and driving control features.","The user aims to find a comfortable SUV with better seating and control features than their current Toyota RAV4, while being flexible on newness and alternatives.","I'm looking for a comfortable SUV with better seating and driving control features than my current Toyota RAV4. I'm open to both new and used models, preferably from the last few years, and I want a gas vehicle. I'm willing to consider alternatives as well. My maximum budget is $35,000.",35000.0
Toyota,RAV4,"I got a 2024 RAV4 XLE Premium model, and Im really disappointed with the vehicle. I expected much better quality from Toyota, especially from the RAV4. First of all, the quality of the interior could be much better. Its a little noisy, and the assembly feels subpar, like it was put together in a backyard. Secondly, after just 8,000 km, the vehicle started leaking oil from the oil pan. The service technician told me its a common issue because Toyota stopped using a gasket on the oil pan and now relies only on silicone sealant. Another frustrating issue is the digital speedometer. I cant get used to it. When the sun is behind you, it's nearly impossible to see your speed while driving. Lastly, for a vehicle that costs over $50,000, its unbelievable that it doesnt even come with a tire pressure monitoring system. I have to point out that this is in Canada. For the price of the vehicle, you'd think they could include such a basic feature.",2,2,11/16/2024,[],"[{""make"": ""Toyota"", ""model"": ""RAV4"", ""year"": 2024, ""condition"": ""new"", ""rationale"": ""The reviewer expresses disappointment with the quality and features of the 2024 RAV4.""}]",[],"[{""make"": ""Toyota"", ""model"": ""RAV4"", ""year"": 2024, ""condition"": ""new"", ""rationale"": ""The reviewer expresses disappointment with the quality and features of the 2024 RAV4.""}]","The reviewer is likely seeking a vehicle that offers better quality and essential features for the price, possibly looking for alternatives to the RAV4.","[""Toyota""]","[""RAV4""]",[2024],either,5,"The reviewer is open to both new and used vehicles, but their current experience with a new vehicle is negative.",SUV,,8,"The reviewer is concerned about quality, essential features, and value for money.","Direct and straightforward, expressing disappointment clearly.","Prefers a conversational approach, focused on quality and value.","The user is likely a family-oriented individual who values reliability and essential features in a vehicle, given their disappointment with the RAV4.","The user is seeking a high-quality SUV with essential features and good value, looking for alternatives to the 2024 RAV4.","I'm looking for a reliable SUV, preferably not a Toyota, since I'm disappointed with my 2024 RAV4. It should be either new or used, but I want something that feels well-built and has essential features like a tire pressure monitoring system. I'm open to alternatives and willing to spend up to $50,000. I need a vehicle that offers better quality and value for my money.",50000.0
Chevrolet,Traverse,"Man, Chevrolet just hit it out of the park with this one. The redesigned 2024 Traverse looks like a truck. Bigger than any other mid-sized SUV, more space compared to all midsize SUVs, best looking mid sized SUV. Everything is grand and big. Very comfortable seats. Engine is 4-cyl with turbo and works adequately. Will make a sound when accelerated or pushed hard but not a deal breaker. The infotainment system/screen and tech is amazing. Rear view camera, park assist, 360 degree camera. Ambient lighting. Mind blown! My first American car after having 4 japanese cars (3 Mazdas and 1 Suzuki) and 1 German (BMW). I am amazed. Hopefully this wont break because I am hearing complaints about failed transmission from some Z71 AWD twin clutch vehicles. I get an average of about 22 in city and 28 on the highways. Wish there was a hybrid option but then I remembered Toyota Grand Highlander has a stop sale on their models. Honda pilot, Kia Telluride and Hyundai Palisade doesn't have as of writing this review in Sep 2024. Mazda CX-90 was my other choice but it has no space in the 3rd row and behind the 3rd row. This traverse a decent sized adult can easily fit in the 3rd row. The steering wheel is so thick and suspension very soft. Comfortable for families who love some flare!",5,5,9/17/2024,"[{""make"": ""Chevrolet"", ""model"": ""Traverse"", ""year"": 2024, ""condition"": ""new"", ""rationale"": ""The reviewer praises the redesigned 2024 Traverse for its size, comfort, and features.""}]","[{""make"": ""Toyota"", ""model"": ""Grand Highlander"", ""year"": 2024, ""condition"": ""new"", ""rationale"": ""The reviewer mentions a stop sale on their models.""}, {""make"": ""Mazda"", ""model"": ""CX-90"", ""year"": 2024, ""condition"": ""new"", ""rationale"": ""The reviewer notes it has no space in the 3rd row.""}, {""make"": ""Honda"", ""model"": ""Pilot"", ""year"": 2024, ""condition"": ""new"", ""rationale"": ""The reviewer implies it doesn't meet their needs compared to the Traverse.""}, {""make"": ""Kia"", ""model"": ""Telluride"", ""year"": 2024, ""condition"": ""new"", ""rationale"": ""The reviewer implies it doesn't meet their needs compared to the Traverse.""}, {""make"": ""Hyundai"", ""model"": ""Palisade"", ""year"": 2024, ""condition"": ""new"", ""rationale"": ""The reviewer implies it doesn't meet their needs compared to the Traverse.""}]","[{""make"": ""Chevrolet"", ""model"": ""Traverse"", ""year"": 2024, ""condition"": ""new"", ""rationale"": ""The reviewer praises the redesigned 2024 Traverse for its size, comfort, and features.""}]","[{""make"": ""Toyota"", ""model"": ""Grand Highlander"", ""year"": 2024, ""condition"": ""new"", ""rationale"": ""The reviewer mentions a stop sale on their models.""}, {""make"": ""Mazda"", ""model"": ""CX-90"", ""year"": 2024, ""condition"": ""new"", ""rationale"": ""The reviewer notes it has no space in the 3rd row.""}, {""make"": ""Honda"", ""model"": ""Pilot"", ""year"": 2024, ""condition"": ""new"", ""rationale"": ""The reviewer implies it doesn't meet their needs compared to the Traverse.""}, {""make"": ""Kia"", ""model"": ""Telluride"", ""year"": 2024, ""condition"": ""new"", ""rationale"": ""The reviewer implies it doesn't meet their needs compared to the Traverse.""}, {""make"": ""Hyundai"", ""model"": ""Palisade"", ""year"": 2024, ""condition"": ""new"", ""rationale"": ""The reviewer implies it doesn't meet their needs compared to the Traverse.""}]","The reviewer is looking for a spacious and comfortable SUV that meets family needs, while also considering alternatives that may offer hybrid options.","[""Chevrolet"", ""Mazda"", ""Suzuki"", ""BMW"", ""Toyota"", ""Honda"", ""Kia"", ""Hyundai""]","[""Traverse"", ""Mazda"", ""Grand Highlander"", ""Pilot"", ""Telluride"", ""Palisade"", ""CX-90""]",[2024],new,10,The reviewer specifically praises the new 2024 model.,SUV,gas,5,"The reviewer values comfort, space, and technology features, while being cautious about reliability.","Conversational and enthusiastic, with a focus on personal experiences and preferences.",Open to suggestions but prefers clear recommendations based on specific needs.,The user is likely a family-oriented individual looking for a spacious and comfortable SUV that accommodates adults in the third row and includes modern technology features.,"The user aims to find a new, spacious, and comfortable SUV with good technology features, while being cautious about reliability and considering alternatives with hybrid options.","I'm looking for a new 2024 Chevrolet Traverse because it seems perfect for my family's needs with its spacious third row and great tech features. I'm also open to alternatives that might offer hybrid options, but they need to be comfortable and reliable. My budget is up to $50,000.",50000.0
Chevrolet,Traverse,Like: 1. Looks 2. Ride and handling 3. Interior design Don Like: 1. Noisy engine 2. Transmission shift pattern 3. Lack of some tech functionality that was expected 4. Paddle shifters that does not function as paddle shifters 5. Higher fuel consumption than second generation,3,3,9/1/2024,"[{""make"": ""Chevrolet"", ""model"": ""Traverse"", ""year"": null, ""condition"": ""unspecified"", ""rationale"": ""The reviewer appreciates the looks, ride and handling, and interior design of the Chevrolet Traverse.""}]","[{""make"": ""Chevrolet"", ""model"": ""Traverse"", ""year"": null, ""condition"": ""unspecified"", ""rationale"": ""The reviewer criticizes the noisy engine, transmission shift pattern, lack of expected tech functionality, non-functional paddle shifters, and higher fuel consumption compared to the second generation.""}]","[{""make"": ""Chevrolet"", ""model"": ""Traverse"", ""year"": null, ""condition"": ""unspecified"", ""rationale"": ""The reviewer appreciates the looks, ride and handling, and interior design of the Chevrolet Traverse.""}]","[{""make"": ""Chevrolet"", ""model"": ""Traverse"", ""year"": null, ""condition"": ""unspecified"", ""rationale"": ""The reviewer criticizes the noisy engine, transmission shift pattern, lack of expected tech functionality, non-functional paddle shifters, and higher fuel consumption compared to the second generation.""}]",The reviewer is likely seeking recommendations for vehicles that offer better technology features and fuel efficiency while maintaining the positive aspects of the Chevrolet Traverse.,"[""Chevrolet""]","[""Traverse""]",[],unspecified,5,"The reviewer does not specify a preference for new or used, indicating openness to both.",SUV,gas,7,The reviewer values aesthetics and comfort but is concerned about performance and technology.,"Conversational and straightforward, with a focus on expressing specific preferences and concerns.",Open to suggestions but values clear comparisons and recommendations.,"The reviewer is likely a family-oriented individual who appreciates comfort and aesthetics in a vehicle, possibly considering space and functionality for family use.","The user aims to find an SUV that balances aesthetics, comfort, better technology features, and improved fuel efficiency compared to the Chevrolet Traverse, while remaining open to alternatives.","I'm looking for an SUV that offers great looks, comfort, and better technology than my Chevrolet Traverse. I want something that is more fuel-efficient and has a smoother transmission. I'm open to both new and used models, ideally from the last few years, and I prefer gas fuel. I’m willing to consider alternatives and my budget is around $35,000.",35000.0
Chevrolet,Traverse,"The redesign of this truck is what brought us towards it. Spent an Arm on a 24 RS which we loved for about 3 weeks. After that, where do I even start, Ive only made 2 payments on this car and it has been nothing short of a nightmare. The transmission blew with only 900 miles on it ruining my driveway. It leaked the entire transmission while parked over night. The car has needed 3 alignments in the 2 months of ownership along with some dealership mistakes with scratches and rim rashes. With 1600 miles on it, supercruise took me off the side of the highway and disengaged almost sending me into the woods at 70 mph. On top of that the car went into break assist merging onto the highway coming to a complete stop from 50 almost causing another major accident. GM has offered me 400 gm points for my inconvenience while having my truck almost have the of the time Ive owned the car. I would not recommend this car to my worst enemy. Between my family and my wifes we have owned upwards of 30 gm products which I dont think I will ever purchase another one after this experience. ",1,1,1/21/2025,[],"[{""make"": ""Chevrolet"", ""model"": ""Traverse"", ""year"": null, ""condition"": ""new"", ""rationale"": ""The reviewer had a very negative experience with the Chevrolet Traverse, citing multiple issues including transmission failure and safety concerns.""}]",[],"[{""make"": ""Chevrolet"", ""model"": ""Traverse"", ""year"": null, ""condition"": ""new"", ""rationale"": ""The reviewer had a very negative experience with the Chevrolet Traverse, citing multiple issues including transmission failure and safety concerns.""}]",The reviewer is likely seeking a recommendation for a reliable vehicle that does not have the issues experienced with their current Chevrolet Traverse.,"[""Chevrolet"", ""GM""]","[""Traverse""]",[],used,1,"The reviewer had a terrible experience with a new vehicle, indicating a strong preference against new cars.",SUV,,1,"The reviewer prioritizes reliability and safety, given their negative experience with the Traverse.","Frustrated and straightforward, expressing strong opinions based on personal experience.","Direct and candid, seeking clear recommendations without unnecessary details.","The reviewer has a family that has owned multiple GM vehicles, indicating a long history with the brand, which makes their negative experience particularly impactful.",The user is looking for a reliable used SUV that prioritizes safety and avoids the issues they faced with the Chevrolet Traverse.,"I'm looking for a reliable used SUV, preferably not a Chevrolet or GM, since I've had a terrible experience with the Traverse. I want something that is safe and won't have the issues I faced, like transmission problems. I’m not interested in new cars at all. My budget is up to $30,000.",30000.0
Chevrolet,Traverse,"We have just over 2000 miles on our RS, which is our third Traverse. We drove from Illinois to Houston, and I will say that super cruise is one of those things that you didn't you needed until you got it. It makes interstate driving much less tiring and I think safer as it allows you to better monitor what is going on around you. The tech is great. I can just say the destination and away we go, no punching in addresses. My one gripe is the tailgate. The kick was so much better. The new gate is not hands free to close, which is when you really need it. And you need to stay away from the back of the car if you have the key and you don't want the tailgate to open. Also, the driver screen could be better designed. But most importantly the car swallows cargo like nothing else.",5,5,7/27/2024,"[{""make"": ""Chevrolet"", ""model"": ""Traverse"", ""year"": null, ""condition"": ""either"", ""rationale"": ""The reviewer expresses satisfaction with their third Traverse and praises its features.""}]","[{""make"": ""Chevrolet"", ""model"": ""Traverse"", ""year"": null, ""condition"": ""either"", ""rationale"": ""The reviewer criticizes the new tailgate design and the driver screen layout.""}]","[{""make"": ""Chevrolet"", ""model"": ""Traverse"", ""year"": null, ""condition"": ""either"", ""rationale"": ""The reviewer expresses satisfaction with their third Traverse and praises its features.""}]","[{""make"": ""Chevrolet"", ""model"": ""Traverse"", ""year"": null, ""condition"": ""either"", ""rationale"": ""The reviewer criticizes the new tailgate design and the driver screen layout.""}]","The reviewer is likely looking for recommendations for vehicles with advanced tech features and good cargo capacity, while avoiding those with poor design elements.","[""Chevrolet""]","[""Traverse""]",[],either,8,"The reviewer appreciates modern tech features, indicating a preference for newer models.",SUV,,7,"The reviewer values safety and convenience features, particularly in long-distance driving.","Conversational and straightforward, with a focus on personal experiences and practical needs.","Direct and informative, seeking specific recommendations based on preferences and experiences.","The user likely has a family, as they value cargo capacity and safety features for long-distance travel, suggesting they often travel with others.","The user is looking for SUV recommendations with advanced tech features and good cargo capacity, while avoiding poor design elements, ideally newer models.","I'm looking for a new SUV, ideally similar to the Chevrolet Traverse, with advanced tech features and great cargo space. I prefer models from 2023 or newer and am open to alternatives as long as they have good safety and convenience features for long trips. My budget is up to $50,000.",50000.0
Chevrolet,Malibu,"I love everything about the vehicle. From the body, to the spaciousness, to the carplay and touchscreen navigation/stereo system with beats brand speakers. Moreover, I love the heated seats, power seats, electric emergency/parking brake, the engine, the smoothness of the ride and how much it saves on gas! Furthermore, I admire the option to take off auto stop, the forward collision option, the lane switch assist option, the backup camera and the way the mirrors tilt themselves when youre parking to help. The car is overall luxurious as well as safe and saves on gas. Five Stars.",5,5,1/9/2023,"[{""make"": ""Chevrolet"", ""model"": ""Malibu"", ""year"": null, ""condition"": ""either"", ""rationale"": ""The reviewer loves everything about the vehicle, indicating a strong preference.""}]",[],"[{""make"": ""Chevrolet"", ""model"": ""Malibu"", ""year"": null, ""condition"": ""either"", ""rationale"": ""The reviewer loves everything about the vehicle, indicating a strong preference.""}]",[],"The reviewer is likely looking for recommendations for vehicles that offer luxury, safety, and fuel efficiency similar to their Chevrolet Malibu.","[""Chevrolet""]","[""Malibu""]",[],either,10,"The reviewer expresses a strong positive sentiment towards their current vehicle, suggesting a preference for newer models.",sedan,gas,5,"The reviewer values luxury features, safety options, and fuel efficiency.","Conversational and enthusiastic, with a focus on personal experience and preferences.","Direct and friendly, seeking detailed recommendations based on specific criteria.","The reviewer likely values comfort and safety for family trips, as indicated by their appreciation for luxury and safety features in vehicles.","The user is looking for recommendations for a new or used sedan similar to their Chevrolet Malibu, emphasizing luxury, safety, and fuel efficiency.","I'm looking for a new or used sedan, ideally a Chevrolet Malibu or something similar, that offers luxury features, safety options, and great fuel efficiency. I want it to be as new as possible, preferably from 2025 or later, and I’m open to alternatives if they meet my criteria. My budget is up to $35,000.",35000.0
Chevrolet,Malibu,"The 1.5T engine has not been updated since the 2016 model year and has the lowest horsepower and worst fuel economy in the midsize sedan class. Additionally, there is no all-wheel drive or a hybrid powertrain option. The interior has not been updated since the 2016 model year and uses low quality materials everywhere. The instrument gauge cluster and A/C controls are severely outdated for a $30k car in 2024. The rear passenger A/C vents do not have USB charging ports, and the wireless phone charger is incompatible with newer phone models. The road and tire noise is excessively loud. The technology is several years behind the competition. LED headlights are only available on the highest trim level. The highest 2LT trim level does not come standard with adaptive cruise control, blind-spot monitoring, or rear cross-traffic alert. Competitors offer these features standard on all trim levels. For the MSRP of $30k, youre better off buying a Japanese or Korean competitor. The Malibu is a decade old car made for rental agencies.",1,1,10/8/2024,[],"[{""make"": ""Chevrolet"", ""model"": ""Malibu"", ""year"": 2024, ""condition"": ""new"", ""rationale"": ""The reviewer criticizes the outdated features and poor performance of the 2024 Chevrolet Malibu.""}]",[],"[{""make"": ""Chevrolet"", ""model"": ""Malibu"", ""year"": 2024, ""condition"": ""new"", ""rationale"": ""The reviewer criticizes the outdated features and poor performance of the 2024 Chevrolet Malibu.""}]",The reviewer is looking for a better vehicle option that offers modern features and better performance than the Chevrolet Malibu.,"[""Chevrolet""]","[""Malibu""]",[2024],either,1,"The reviewer indicates a strong preference against the outdated Malibu, suggesting a desire for something more current.",sedan,gas,10,The reviewer emphasizes the need for modern technology and features that are standard in competitors.,"Direct and critical, focusing on specific issues and preferences.","Inquisitive and open to suggestions, seeking clear and modern options.","The reviewer is likely a practical buyer who values modern features and technology, possibly for family use.",The user aims to find a modern sedan with better performance and technology than the outdated Chevrolet Malibu.,"I'm looking for a modern sedan that offers better performance and technology than the 2024 Chevrolet Malibu. I prefer a gas vehicle and am open to both new and used options, but I want something much newer than the Malibu. My budget is up to $30,000, and I need standard features like adaptive cruise control and blind-spot monitoring. Please recommend alternatives that are competitive in the midsize class.",30000.0
