Make,Model,Review,ratings,Rating,date,like_option,dislike_option,liked_options,disliked_options,user_intention,mentioned_makes,mentioned_models,mentioned_years,preferred_condition,newness_preference_score,newness_preference_notes,preferred_vehicle_type,preferred_fuel_type,openness_to_alternatives,misc_notes,persona_writing_style,persona_interaction_style,persona_family_background,persona_goal_summary,persona_query,persona_upper_price_limit
Acura,ADX,"This is has been a great buy so far. The value that you get on the top trim, compared to other luxury entry level SUVs, is simply unbeatable. This trim comes loaded with all the latest driver-assist technology and the music produced by its 15 speaker sound system is outstanding. Some may knock the ADXs 190 horse power engine; however, the car is fast enough for me. After all, I am more interested in a comfortable quiet ride than in winning a car race. UPDATE: I love my new Acura ADX. It looks sporty and while the engine power gets a bad rap, the ride on the individual sports/comfort mode is just a perfect combination of power and luxury ride. The top trim has most of the luxury SUVs bells and whistles, including a super nice sound system with 15 speakers that sounds fantastic. The infotainment is very easy to use. Overall, the top trim of this SUV is a good value for your money. Also, I take Honda engineering against any German or any other European car. This is just my personal preference, based on owning Hondas most of my life.",5,5,7/1/2025,"[{""make"": ""Acura"", ""model"": ""ADX"", ""year"": null, ""condition"": ""new"", ""rationale"": ""The reviewer praises the top trim of the Acura ADX for its value, luxury features, and comfort.""}]",[],"[{""make"": ""Acura"", ""model"": ""ADX"", ""year"": null, ""condition"": ""new"", ""rationale"": ""The reviewer praises the top trim of the Acura ADX for its value, luxury features, and comfort.""}]",[],"The reviewer is looking for a vehicle that offers a combination of luxury, comfort, and good value, particularly in the SUV category.","[""Acura"", ""Honda""]","[""ADX""]",[],new,10,"The reviewer expresses satisfaction with their new Acura ADX, indicating a preference for new vehicles.",SUV,gas,5,"The reviewer values comfort and luxury features over raw engine power, and prefers Honda engineering over European brands.","Concise and enthusiastic, with a focus on personal experience and satisfaction.","Direct and straightforward, seeking clear recommendations based on specific preferences.","The reviewer has a strong preference for Honda engineering, having owned Hondas for most of their life, indicating a loyalty to reliable brands.","The user is looking for a new luxury SUV that offers comfort, good value, and advanced features, similar to their positive experience with the Acura ADX.","I'm looking for a new luxury SUV like the Acura ADX, ideally from 2025 or newer. I prefer gas fuel and value comfort and luxury features over raw power. I’m open to alternatives but would like to stick with Honda engineering if possible. My budget is up to $50,000.",50000.0
Toyota,Camry,"After 30 plus years at GM and always buying GM products. GM does not make a hybrid anymore. Was going to buy a 2024 Trax. Looking at the build sheet, seeing it had a 3 cylinder engine and built in Korea, I canceled the order. If I'm going to buy foreign, might as well buy a car with proven longevity. Not only that, it made in Kentucky. The 2025 Camry restyling is eye catching. Have the white pearl color. Black interior. Have yet to open panoramic sun roof,(probably never use it). Instrumentation panel is very interactive and pretty easy to use while driving. Our Rav4 was typical suv noisy. But this Camry made me understand why the loyalty to Camry. Drives very well. In cruise mode it does all the safety features well. Braking and lane departure. Getting in no problem, getting out tells me I need to lose a pound and wish I was 10 years younger. Great car and wish GM had a hybrid. Do your homework and see what cars GM makes in the US, only high $ profit products. John.",5,5,6/20/2024,"[{""make"": ""Toyota"", ""model"": ""Camry"", ""year"": 2025, ""condition"": ""new"", ""rationale"": ""The reviewer praises the 2025 Camry for its eye-catching restyling, driving experience, and safety features.""}]","[{""make"": ""GM"", ""model"": ""Trax"", ""year"": 2024, ""condition"": ""new"", ""rationale"": ""The reviewer canceled the order for the 2024 Trax due to its 3-cylinder engine and foreign manufacturing.""}, {""make"": ""GM"", ""model"": null, ""year"": null, ""condition"": ""unspecified"", ""rationale"": ""The reviewer expresses disappointment that GM does not make a hybrid anymore.""}]","[{""make"": ""Toyota"", ""model"": ""Camry"", ""year"": 2025, ""condition"": ""new"", ""rationale"": ""The reviewer praises the 2025 Camry for its eye-catching restyling, driving experience, and safety features.""}]","[{""make"": ""GM"", ""model"": ""Trax"", ""year"": 2024, ""condition"": ""new"", ""rationale"": ""The reviewer canceled the order for the 2024 Trax due to its 3-cylinder engine and foreign manufacturing.""}, {""make"": ""GM"", ""model"": null, ""year"": null, ""condition"": ""unspecified"", ""rationale"": ""The reviewer expresses disappointment that GM does not make a hybrid anymore.""}]",The reviewer is looking for a reliable hybrid vehicle option and is interested in recommendations for cars that are made in the US with proven longevity.,"[""Toyota"", ""GM""]","[""Camry"", ""Trax""]","[2024, 2025]",new,10,"The reviewer is specifically interested in new vehicles, as indicated by their focus on the 2025 Camry.",sedan,hybrid,5,"The reviewer values safety features and reliability, as well as the importance of US manufacturing.","Conversational and reflective, with a focus on personal experience and practical considerations.","Direct and informative, seeking detailed recommendations based on specific preferences.","The user has a long history with GM vehicles but is now looking for a reliable hybrid option made in the US, emphasizing safety and longevity.","The user aims to find a new hybrid sedan, specifically a Toyota Camry or similar, that is made in the US and offers strong safety features, with a maximum budget of $35,000.","I'm looking for a new hybrid sedan, ideally a Toyota Camry 2025 or a similar model, made in the US. I value safety features and reliability, and I want something with proven longevity. My budget is up to $35,000, and I'm open to alternatives, but I prefer something new and eye-catching like the Camry. Can you help me find the best options?",35000.0
Toyota,Camry,"Likes: Mpg 45-50 combined Ride About perfect balance Noise levels. Very quiet Wireless CarPlay and qi charge. Didn't expect to like this so much! Can sit in car with ac on just battery power Toyota hybrids are proven reliable This is the same engine setup as crown 220 hp and great low end torque Dislikes : Steering. Electric feel Radio sound. Mid Air conditioning. Might be a tad weak Screen. Great res wish it was bigger Stance. For me, I don't like getting so low in a car. I wish seats a little more upright Overall extremely happy with the car! I had a 2018 Camry and 2020 accord. The hybrid system is really a joy to drive. Quiet , fast , and reliable feels luxury!",5,5,8/16/2024,"[{""make"": ""Toyota"", ""model"": ""Camry"", ""year"": null, ""condition"": ""either"", ""rationale"": ""The reviewer expresses overall happiness with the car, praising its MPG, ride quality, quietness, and reliability.""}]","[{""make"": ""Toyota"", ""model"": ""Camry"", ""year"": null, ""condition"": ""either"", ""rationale"": ""The reviewer mentions dissatisfaction with the steering feel, radio sound, air conditioning strength, screen size, and seating position.""}]","[{""make"": ""Toyota"", ""model"": ""Camry"", ""year"": null, ""condition"": ""either"", ""rationale"": ""The reviewer expresses overall happiness with the car, praising its MPG, ride quality, quietness, and reliability.""}]","[{""make"": ""Toyota"", ""model"": ""Camry"", ""year"": null, ""condition"": ""either"", ""rationale"": ""The reviewer mentions dissatisfaction with the steering feel, radio sound, air conditioning strength, screen size, and seating position.""}]","The reviewer is likely looking for recommendations for reliable and efficient vehicles, particularly hybrids, that offer a comfortable driving experience.","[""Toyota""]","[""Camry"", ""Accord""]","[2018, 2020]",either,8,The reviewer appreciates newer technology and features but does not specify a strict preference for new over used.,sedan,hybrid,7,"The reviewer values reliability, comfort, and efficiency in their vehicle choice.","Conversational and enthusiastic, with a focus on personal experiences and preferences.","Direct and friendly, seeking clear recommendations based on specific criteria.","The user values reliability and comfort, likely considering family needs when choosing a vehicle.","The user aims to find a reliable and efficient hybrid sedan, preferably a newer model, that offers comfort and advanced features.","I'm looking for a reliable and efficient hybrid sedan, ideally a Toyota Camry or something similar from 2021 or newer. I appreciate the comfort and quiet ride, but I want to avoid weak air conditioning and poor radio sound. I'm open to alternatives but prefer newer tech. My budget is up to $35,000.",35000.0
Toyota,Camry,"I've owned this car for nearly 4 months and initially had no issues. In the past month, I've had numerous issues relating to the electronics and many of the vehicle's features associated with them. Specifically: Dashboard displays blank out or change to other screens without any input from me Lane Departure Assist was deactivated twice and turned itself back On both times, after a period of weeks. I hate this feature and finding it back On............I was not pleased Seat slide and driver's seat programming have stopped functioning, repeatedly While driving on the highway, Cruise Control has turned On without any action on my part. It scared the crap out of me when the vehicle suddenly accelerated in heavy traffic Apple CarPlay keeps disconnecting and I have to reconnect it manually All of my radio presets have erased and had to be reset - which is not easy in this vehicle Frequently, the car does not recognize me as the driver (I think it links with my phone) and thinks I am a guest driver. The last time was when I took it to a carwash and someone else drove it int/out of the tunnel. When I got in it, much of my programming was gone. It has TOO MANY features and they are highly distracting. This is my 3rd Camry. I liked my 2012 XLE Hybrid much better. I wish I'd kept it.",2,2,10/19/2024,"[{""make"": ""Toyota"", ""model"": ""Camry"", ""year"": 2012, ""condition"": ""used"", ""rationale"": ""The reviewer expresses a preference for their previous 2012 Camry XLE Hybrid, indicating they liked it better than the current model.""}]","[{""make"": ""Toyota"", ""model"": ""Camry"", ""year"": null, ""condition"": ""new"", ""rationale"": ""The reviewer is dissatisfied with the current Camry due to numerous electronic issues and distracting features.""}]","[{""make"": ""Toyota"", ""model"": ""Camry"", ""year"": 2012, ""condition"": ""used"", ""rationale"": ""The reviewer expresses a preference for their previous 2012 Camry XLE Hybrid, indicating they liked it better than the current model.""}]","[{""make"": ""Toyota"", ""model"": ""Camry"", ""year"": null, ""condition"": ""new"", ""rationale"": ""The reviewer is dissatisfied with the current Camry due to numerous electronic issues and distracting features.""}]","The reviewer is likely seeking a recommendation for a more reliable vehicle, possibly a used model that is simpler and less prone to electronic issues.","[""Toyota""]","[""Camry""]",[2012],used,5,"The reviewer prefers a used vehicle, as they express a strong preference for their previous model over the current one.",sedan,hybrid,5,The reviewer values reliability and simplicity in vehicle features.,"Conversational and straightforward, expressing frustration with current vehicle issues.","Direct and focused, seeking specific recommendations based on past experiences.","The user likely has a family and values reliability and safety in their vehicle choices, having previously owned multiple Camrys.","The user is looking for a reliable used sedan, preferably a hybrid, that is simpler and less prone to electronic issues than their current Camry.","I'm looking for a reliable used sedan, preferably a Toyota Camry from around 2012 or similar, as I liked my previous 2012 XLE Hybrid much better than my current model. I want a hybrid, and I value simplicity and reliability in features. I'm open to alternatives but prefer something not too new, ideally under $20,000. Please help me find something that won't have the electronic issues I've faced recently.",20000.0
Honda,Civic,"I purchased a 2025 Civic Sport on 3/29/25 and after one day of driving Im ready to trade it off. 30k down the drain! My wife & I test drove it locally around the dealership and never took it out on the highway and thats where we made a huge mistake. MONSTER MISTAKE! Anything over 40 mph and the people in the backseat wont be able to talk to each other or have a conversation with the people in the front. Anything over 55mph on a concrete highway and you cant hear the stereo unless its at half volume, and forget about having any type of conversation. Its noisy!! All the previous reviews that complain about the braking and lighting issues are correct. As we left the dealership I about had an accident when the lane assist yanked the steering wheel and I about swerved into a passing car. Super scary and Im glad my 16yr old daughter wasnt driving it. Im 55 and Ive bought roughly 15 new cars in my time and this is by far the biggest disappointment. I gave it two stars because it looks nicer than the competitors but thats being generous. Its prettier than the competitors but drivability and road noise are a serious issue with the 2025 Civic Sport Sedan. ",2,2,3/30/2025,[],"[{""make"": ""Honda"", ""model"": ""Civic"", ""year"": 2025, ""condition"": ""new"", ""rationale"": ""The reviewer expresses significant disappointment with the 2025 Civic Sport, citing issues with noise and drivability.""}]",[],"[{""make"": ""Honda"", ""model"": ""Civic"", ""year"": 2025, ""condition"": ""new"", ""rationale"": ""The reviewer expresses significant disappointment with the 2025 Civic Sport, citing issues with noise and drivability.""}]",The reviewer is looking to trade in their 2025 Honda Civic Sport due to dissatisfaction and is likely seeking recommendations for a quieter and more reliable vehicle.,"[""Honda""]","[""Civic""]",[2025],new,2,"The reviewer is disappointed with a new vehicle, indicating a preference for something more reliable and quieter.",sedan,,8,"The reviewer prioritizes comfort and drivability, particularly noise levels and safety features.","Direct and candid, expressing frustration with previous experiences.","Prefers straightforward communication, focusing on practical advice and recommendations.","The user is a 55-year-old individual with a wife and a 16-year-old daughter, indicating family considerations in vehicle choice.",The user seeks recommendations for a quieter and more reliable sedan to replace their disappointing 2025 Honda Civic Sport.,"I'm looking to trade in my 2025 Honda Civic Sport because it's too noisy and has drivability issues. I want a new sedan that prioritizes comfort and safety features, ideally something quieter. I'm open to alternatives and would consider models from other brands. My maximum budget is $30,000.",30000.0
Honda,Civic,32 mpg and filling up twice on a six hour drive is extremely disappointing. We got 52mpg from our Hyundai Ioniq and filled up once on a 1200 mile drive. The seat heaters are on timers and shut off and there is a subscription to get a garage door opener on this car. The smart cruise control will suddenly slow the car abruptly with no car in front of us. SO much regret selling our Ioniq to our daughter because she needed a reliable car. I would have skipped over this car had I known it was no better than a gas only Elantra. Has good pickup but thats about the only plus. ,2,2,12/22/2024,"[{""make"": ""Hyundai"", ""model"": ""Ioniq"", ""year"": null, ""condition"": ""either"", ""rationale"": ""The reviewer praises the Ioniq for its fuel efficiency, filling up only once on a long drive.""}]","[{""make"": ""Honda"", ""model"": ""Civic"", ""year"": null, ""condition"": ""either"", ""rationale"": ""The reviewer expresses disappointment with the Civic's fuel efficiency and features.""}, {""make"": ""Hyundai"", ""model"": ""Elantra"", ""year"": null, ""condition"": ""either"", ""rationale"": ""The reviewer compares the Civic unfavorably to the Elantra, indicating they find it lacking.""}]","[{""make"": ""Hyundai"", ""model"": ""Ioniq"", ""year"": null, ""condition"": ""either"", ""rationale"": ""The reviewer praises the Ioniq for its fuel efficiency, filling up only once on a long drive.""}]","[{""make"": ""Honda"", ""model"": ""Civic"", ""year"": null, ""condition"": ""either"", ""rationale"": ""The reviewer expresses disappointment with the Civic's fuel efficiency and features.""}, {""make"": ""Hyundai"", ""model"": ""Elantra"", ""year"": null, ""condition"": ""either"", ""rationale"": ""The reviewer compares the Civic unfavorably to the Elantra, indicating they find it lacking.""}]","The reviewer is likely seeking a more fuel-efficient and reliable vehicle, possibly looking for alternatives to the Civic.","[""Honda"", ""Hyundai""]","[""Civic"", ""Ioniq"", ""Elantra""]",[],either,5,"The reviewer does not specify a strong preference for new or used, indicating flexibility.",,gas,8,"The reviewer values fuel efficiency and reliability, as indicated by their regret over selling the Ioniq.","Direct and critical, expressing disappointment and personal experience.",Conversational with a focus on personal needs and practical outcomes.,"The reviewer sold their Hyundai Ioniq to their daughter, indicating a family-oriented decision, and they are now seeking a reliable vehicle for themselves.","To find a more fuel-efficient and reliable car, preferably with better performance than the Honda Civic.","I'm looking for a reliable and fuel-efficient car, ideally similar to my previous Hyundai Ioniq, which I regret selling. I want a gas vehicle, either new or used, with a preference for models from 2021 or later. I'm open to alternatives but would like to avoid the Honda Civic and Hyundai Elantra. My budget is up to $30,000.",30000.0
Honda,Civic,"My Civic history goes back 50 years to a new 1976 Hatch CVCC, I also had an '80 and '83 of that generation. New baby, low income at the time, long commute, dependable were key considerations. 40 years go by and I got the next Honda - a 2024 ST Hatch last January after ""growing up"" and selling my Golf ""R"". I was disappointed with the driving dynamic and CVT after the Golf R manual. I tested the ST hybrid in November and was amazed by the difference that 20 hp and 50 lb-ft of torque and the difference in ""transmission"" with the electric motor makes. Amazing! Otherwise its the same great CIvic. Nits are the passenger seat position, stock tires, absence of homelink and SXM. I've adapted and accepted the later two. I'll upgrade the tires after I get a year or so out of them. That will improve handling further and maybe the road noise. Passengers will not notice the seating. I'll get a little towel for lumbar support. I paid sticker for the 2024 ST Hatch - $32,500. I was able to work a negotiated $3,000 off sticker for the hybrid in mid December - at $31,045 this is a steal.",4,4,1/23/2025,"[{""make"": ""Honda"", ""model"": ""Civic"", ""year"": 2024, ""condition"": ""new"", ""rationale"": ""The reviewer appreciates the 2024 ST Hatch for its performance and reliability.""}, {""make"": ""Honda"", ""model"": ""Civic"", ""year"": 2024, ""condition"": ""new"", ""rationale"": ""The reviewer was impressed by the ST hybrid's performance compared to the standard model.""}]","[{""make"": ""Honda"", ""model"": ""Civic"", ""year"": 2024, ""condition"": ""new"", ""rationale"": ""The reviewer expressed disappointment with the driving dynamics and CVT compared to the Golf R.""}, {""make"": ""Honda"", ""model"": ""Civic"", ""year"": 2024, ""condition"": ""new"", ""rationale"": ""The reviewer criticized the passenger seat position and stock tires.""}]","[{""make"": ""Honda"", ""model"": ""Civic"", ""year"": 2024, ""condition"": ""new"", ""rationale"": ""The reviewer appreciates the 2024 ST Hatch for its performance and reliability.""}, {""make"": ""Honda"", ""model"": ""Civic"", ""year"": 2024, ""condition"": ""new"", ""rationale"": ""The reviewer was impressed by the ST hybrid's performance compared to the standard model.""}]","[{""make"": ""Honda"", ""model"": ""Civic"", ""year"": 2024, ""condition"": ""new"", ""rationale"": ""The reviewer expressed disappointment with the driving dynamics and CVT compared to the Golf R.""}, {""make"": ""Honda"", ""model"": ""Civic"", ""year"": 2024, ""condition"": ""new"", ""rationale"": ""The reviewer criticized the passenger seat position and stock tires.""}]","The reviewer is looking for recommendations on vehicles that offer better driving dynamics and comfort features, particularly in the hybrid segment.","[""Honda""]","[""Civic"", ""Golf R""]","[2024, 1976, 1980, 1983]",new,10,"The reviewer has a strong preference for new vehicles, as indicated by their recent purchase of a 2024 model.",hatchback,hybrid,7,"The reviewer values performance, comfort, and reliability, and is willing to upgrade certain features like tires.","Conversational and reflective, with a focus on personal experiences and preferences.","Direct and detailed, seeking specific recommendations based on past experiences.","The user has a new baby and a long commute, which influences their car buying decisions, emphasizing reliability and comfort.",The user is looking for recommendations for a new hybrid hatchback that offers better driving dynamics and comfort features than their current Honda Civic.,"I'm looking for a new hybrid hatchback that offers better driving dynamics and comfort than my 2024 Honda Civic ST Hatch. I was impressed by the performance of the ST hybrid, but I want something that feels more engaging to drive, especially compared to my old Golf R. I'm open to alternatives and willing to spend up to $32,500. My priority is a reliable vehicle that can handle my long commute while accommodating my family needs.",32500.0
